{
  "$schema": "https://json-schema.org/draft/2020-12/schema",
  "$id": "lawbench://contracts/files/settings.schema.json",
  "title": "<应用数据>/settings.json",
  "description": "设置；Key 不在这里（在 Windows 凭据管理器）",
  "type": "object",
  "properties": {
    "v": {
      "const": 1
    },
    "servers": {
      "type": "object",
      "properties": {
        "llm_base_url": {
          "type": "string",
          "pattern": "^http://",
          "description": "6000D 所内地址（局域网）"
        },
        "prep_base_url": {
          "type": "string",
          "pattern": "^http://",
          "description": "395 所内地址（局域网）"
        },
        "llm_alt_base_url": {
          "anyOf": [
            {
              "type": "string",
              "pattern": "^http://",
              "description": "6000D 所外地址（EasyTier 虚拟 IP）；所内地址连不上时自动改用"
            },
            {
              "type": "null"
            }
          ]
        },
        "prep_alt_base_url": {
          "anyOf": [
            {
              "type": "string",
              "pattern": "^http://",
              "description": "395 所外地址（EasyTier 虚拟 IP）"
            },
            {
              "type": "null"
            }
          ]
        }
      },
      "additionalProperties": false,
      "required": [
        "llm_base_url",
        "prep_base_url",
        "llm_alt_base_url",
        "prep_alt_base_url"
      ]
    },
    "defaults": {
      "$ref": "lawbench://contracts/common.schema.json#/$defs/params"
    },
    "skill_presets": {
      "type": "object",
      "additionalProperties": {
        "$ref": "lawbench://contracts/common.schema.json#/$defs/params"
      }
    },
    "templates": {
      "type": "object",
      "properties": {
        "文书": {
          "anyOf": [
            {
              "type": "string"
            },
            {
              "type": "null"
            }
          ]
        },
        "合同": {
          "anyOf": [
            {
              "type": "string"
            },
            {
              "type": "null"
            }
          ]
        }
      },
      "additionalProperties": false,
      "required": [
        "文书",
        "合同"
      ]
    },
    "ocr_fallback_llm": {
      "type": "boolean",
      "description": "395 不可用时由 6000D 接管识别；管理员开启，默认 false"
    },
    "profile": {
      "type": "object",
      "properties": {
        "lawyer_name": {
          "anyOf": [
            {
              "type": "string",
              "description": "本机律师姓名：结案报告、立卷申请书默认的承办律师"
            },
            {
              "type": "null"
            }
          ]
        }
      },
      "additionalProperties": false,
      "required": [
        "lawyer_name"
      ]
    },
    "office": {
      "type": "object",
      "properties": {
        "dir": {
          "anyOf": [
            {
              "type": "string",
              "description": "日常办公文件夹（发票台账等），律师指定；不得位于云同步目录"
            },
            {
              "type": "null"
            }
          ]
        },
        "invoice_buyer": {
          "anyOf": [
            {
              "type": "string",
              "description": "发票购买方名称（律所全称），用于抬头核验"
            },
            {
              "type": "null"
            }
          ]
        }
      },
      "additionalProperties": false,
      "required": [
        "dir",
        "invoice_buyer"
      ]
    },
    "converter": {
      "enum": [
        "auto",
        "word",
        "wps",
        "libreoffice"
      ],
      "description": "Word 转 PDF 用哪个程序；auto = Word → WPS → 内置 LibreOffice 依次尝试"
    }
  },
  "additionalProperties": false,
  "required": [
    "v",
    "servers",
    "defaults",
    "skill_presets",
    "templates",
    "ocr_fallback_llm",
    "profile",
    "office",
    "converter"
  ]
}
