{
  "v": 1,
  "servers": {
    "llm_base_url": "http://192.168.8.77:8000/v1",
    "prep_base_url": "http://192.168.8.124:9000",
    "llm_alt_base_url": "http://10.126.126.1:8000/v1",
    "prep_alt_base_url": "http://10.126.126.3:9000"
  },
  "defaults": {
    "thinking": "中",
    "window": "64K",
    "max_tokens": 16384,
    "temperature": 0.3
  },
  "skill_presets": {
    "contract-review": {
      "thinking": "高",
      "window": "128K",
      "max_tokens": 32768
    }
  },
  "templates": {
    "文书": null,
    "合同": null
  },
  "ocr_fallback_llm": false,
  "profile": {
    "lawyer_name": "李律师"
  },
  "office": {
    "dir": "D:\\日常办公",
    "invoice_buyer": "某某律师事务所"
  },
  "converter": "auto"
}
